{"criteria":["MP2-015.A01","MP2-015.A02"],"governed_rows_sha256":"3574fa8d6a8b696fd77ecbd0f1abdf680155f8b4ac6d6b74a7e4d34c2b401fa4","inventory_path":"docs/status/functional-inventory.json","obligations":["MP2-015.OBL.CHARACTERIZATION","MP2-015.OBL.COMPATIBILITY_RETENTION","MP2-015.OBL.DETERMINISM","MP2-015.OBL.NEGATIVE","MP2-015.OBL.CLEAN"],"owner":"MP2-015","row_count":123,"rows":[{"claim_classification":"compatibility","failure":{"argv":["metriplane","atlas","privacy","anonymize","--mp2-015-invalid-option"],"exit_code":2,"filesystem":{"created":[],"modified":[],"removed":[]},"state":"unchanged","stderr":{"contains":["usage:","error:"],"empty":false,"format":"text"},"stdout":{"contains":[],"empty":true,"format":"text"}},"kind":"cli_alias","profile_id":"repository.current-cli.measured","retained_obligation_id":"MP2-011.OBL.ALIAS_DISCOVERY","row_digest":"6246961e8d86dd8470c1474c023b286c54274df70212fd3e2661858df8c8789b","row_id":"MP2-011.CLI.ALIAS.METRIPLANE_ATLAS_PRIVACY_ANONYMIZE","success":{"argv":["metriplane","atlas","privacy","anonymize","--help"],"exit_code":0,"filesystem":{"created":[],"modified":[],"removed":[]},"state":"unchanged","stderr":{"contains":[],"empty":true,"format":"text"},"stdout":{"contains":["usage:"],"empty":false,"format":"text"}}},{"claim_classification":"compatibility","failure":{"argv":["maniskill-pickcube","acquire","--mp2-015-invalid-option"],"exit_code":2,"filesystem":{"created":[],"modified":[],"removed":[]},"state":"unchanged","stderr":{"contains":["usage:","error:"],"empty":false,"format":"text"},"stdout":{"contains":[],"empty":true,"format":"text"}},"kind":"cli_command","profile_id":"repository.current-cli.measured","retained_obligation_id":"MP2-011.OBL.SUBPARSER_CENSUS","row_digest":"be9bd14211ec74e996810b508de5e7446eb009241624e15115e04bfb0fd33a1d","row_id":"MP2-011.CLI.COMMAND.MANISKILL_PICKCUBE_ACQUIRE","success":{"argv":["maniskill-pickcube","acquire","--help"],"exit_code":0,"filesystem":{"created":[],"modified":[],"removed":[]},"state":"unchanged","stderr":{"contains":[],"empty":true,"format":"text"},"stdout":{"contains":["usage:"],"empty":false,"format":"text"}}},{"claim_classification":"compatibility","failure":{"argv":["maniskill-pickcube","convert","--mp2-015-invalid-option"],"exit_code":2,"filesystem":{"created":[],"modified":[],"removed":[]},"state":"unchanged","stderr":{"contains":["usage:","error:"],"empty":false,"format":"text"},"stdout":{"contains":[],"empty":true,"format":"text"}},"kind":"cli_command","profile_id":"repository.current-cli.measured","retained_obligation_id":"MP2-011.OBL.SUBPARSER_CENSUS","row_digest":"60e66a684d12aee681cfc156c183b1b91d48829208ee5f30f1d1a4ff2e24d3ac","row_id":"MP2-011.CLI.COMMAND.MANISKILL_PICKCUBE_CONVERT","success":{"argv":["maniskill-pickcube","convert","--help"],"exit_code":0,"filesystem":{"created":[],"modified":[],"removed":[]},"state":"unchanged","stderr":{"contains":[],"empty":true,"format":"text"},"stdout":{"contains":["usage:"],"empty":false,"format":"text"}}},{"claim_classification":"compatibility","failure":{"argv":["maniskill-pickcube","finalize-equivalence","--mp2-015-invalid-option"],"exit_code":2,"filesystem":{"created":[],"modified":[],"removed":[]},"state":"unchanged","stderr":{"contains":["usage:","error:"],"empty":false,"format":"text"},"stdout":{"contains":[],"empty":true,"format":"text"}},"kind":"cli_command","profile_id":"repository.current-cli.measured","retained_obligation_id":"MP2-011.OBL.SUBPARSER_CENSUS","row_digest":"eb2af41bf05c86ab1389a179bfd84de72ff250aea683d4375bacb50f3927f8e0","row_id":"MP2-011.CLI.COMMAND.MANISKILL_PICKCUBE_FINALIZE_EQUIVALENCE","success":{"argv":["maniskill-pickcube","finalize-equivalence","--help"],"exit_code":0,"filesystem":{"created":[],"modified":[],"removed":[]},"state":"unchanged","stderr":{"contains":[],"empty":true,"format":"text"},"stdout":{"contains":["usage:"],"empty":false,"format":"text"}}},{"claim_classification":"compatibility","failure":{"argv":["maniskill-pickcube","inspect","--mp2-015-invalid-option"],"exit_code":2,"filesystem":{"created":[],"modified":[],"removed":[]},"state":"unchanged","stderr":{"contains":["usage:","error:"],"empty":false,"format":"text"},"stdout":{"contains":[],"empty":true,"format":"text"}},"kind":"cli_command","profile_id":"repository.current-cli.measured","retained_obligation_id":"MP2-011.OBL.SUBPARSER_CENSUS","row_digest":"34e6354f1bcf2a811c1c5efe18a378138001422f38d92451a7f4dcaa93bf4e62","row_id":"MP2-011.CLI.COMMAND.MANISKILL_PICKCUBE_INSPECT","success":{"argv":["maniskill-pickcube","inspect","--help"],"exit_code":0,"filesystem":{"created":[],"modified":[],"removed":[]},"state":"unchanged","stderr":{"contains":[],"empty":true,"format":"text"},"stdout":{"contains":["usage:"],"empty":false,"format":"text"}}},{"claim_classification":"compatibility","failure":{"argv":["metriplane","ask","--mp2-015-invalid-option"],"exit_code":2,"filesystem":{"created":[],"modified":[],"removed":[]},"state":"unchanged","stderr":{"contains":["usage:","error:"],"empty":false,"format":"text"},"stdout":{"contains":[],"empty":true,"format":"text"}},"kind":"cli_command","profile_id":"repository.current-cli.measured","retained_obligation_id":"MP2-011.OBL.ROOT_DISPATCH","row_digest":"7334550a2ff73a73092598f5c9e32d328b64192574d708980111a9d09b6f61a2","row_id":"MP2-011.CLI.COMMAND.METRIPLANE_ASK","success":{"argv":["metriplane","ask","--help"],"exit_code":0,"filesystem":{"created":[],"modified":[],"removed":[]},"state":"unchanged","stderr":{"contains":[],"empty":true,"format":"text"},"stdout":{"contains":["usage:"],"empty":false,"format":"text"}}},{"claim_classification":"compatibility","failure":{"argv":["metriplane","atlas","--mp2-015-invalid-option"],"exit_code":2,"filesystem":{"created":[],"modified":[],"removed":[]},"state":"unchanged","stderr":{"contains":["usage:","error:"],"empty":false,"format":"text"},"stdout":{"contains":[],"empty":true,"format":"text"}},"kind":"cli_command","profile_id":"repository.current-cli.measured","retained_obligation_id":"MP2-011.OBL.ROOT_DISPATCH","row_digest":"fbc76c8fcd89516e7b3eb44504415c94daa3fbab5458c1d21ab0bdf29f3123bd","row_id":"MP2-011.CLI.COMMAND.METRIPLANE_ATLAS","success":{"argv":["metriplane","atlas","--help"],"exit_code":0,"filesystem":{"created":[],"modified":[],"removed":[]},"state":"unchanged","stderr":{"contains":[],"empty":true,"format":"text"},"stdout":{"contains":["usage:"],"empty":false,"format":"text"}}},{"claim_classification":"compatibility","failure":{"argv":["metriplane","atlas","bench","--mp2-015-invalid-option"],"exit_code":2,"filesystem":{"created":[],"modified":[],"removed":[]},"state":"unchanged","stderr":{"contains":["usage:","error:"],"empty":false,"format":"text"},"stdout":{"contains":[],"empty":true,"format":"text"}},"kind":"cli_command_group","profile_id":"repository.current-cli.measured","retained_obligation_id":"MP2-011.OBL.SUBPARSER_CENSUS","row_digest":"8f743a08ab4e0e507c5535fe4d5c186b96e49f7dfce8d2cecdacfbc05b855bfa","row_id":"MP2-011.CLI.COMMAND.METRIPLANE_ATLAS_BENCH","success":{"argv":["metriplane","atlas","bench","--help"],"exit_code":0,"filesystem":{"created":[],"modified":[],"removed":[]},"state":"unchanged","stderr":{"contains":[],"empty":true,"format":"text"},"stdout":{"contains":["usage:"],"empty":false,"format":"text"}}},{"claim_classification":"compatibility","failure":{"argv":["metriplane","atlas","bench","core","--mp2-015-invalid-option"],"exit_code":2,"filesystem":{"created":[],"modified":[],"removed":[]},"state":"unchanged","stderr":{"contains":["usage:","error:"],"empty":false,"format":"text"},"stdout":{"contains":[],"empty":true,"format":"text"}},"kind":"cli_command","profile_id":"repository.current-cli.measured","retained_obligation_id":"MP2-011.OBL.SUBPARSER_CENSUS","row_digest":"b32a88163d39b0bac8cbdcb01a8638ee9273506dbb5610657894d6b9c7c474d9","row_id":"MP2-011.CLI.COMMAND.METRIPLANE_ATLAS_BENCH_CORE","success":{"argv":["metriplane","atlas","bench","core","--help"],"exit_code":0,"filesystem":{"created":[],"modified":[],"removed":[]},"state":"unchanged","stderr":{"contains":[],"empty":true,"format":"text"},"stdout":{"contains":["usage:"],"empty":false,"format":"text"}}},{"claim_classification":"compatibility","failure":{"argv":["metriplane","atlas","bundle","--mp2-015-invalid-option"],"exit_code":2,"filesystem":{"created":[],"modified":[],"removed":[]},"state":"unchanged","stderr":{"contains":["usage:","error:"],"empty":false,"format":"text"},"stdout":{"contains":[],"empty":true,"format":"text"}},"kind":"cli_command_group","profile_id":"repository.current-cli.measured","retained_obligation_id":"MP2-011.OBL.SUBPARSER_CENSUS","row_digest":"1a8f574bbe901240b6e2c102aec721295665068dd37614e01002255da135daa5","row_id":"MP2-011.CLI.COMMAND.METRIPLANE_ATLAS_BUNDLE","success":{"argv":["metriplane","atlas","bundle","--help"],"exit_code":0,"filesystem":{"created":[],"modified":[],"removed":[]},"state":"unchanged","stderr":{"contains":[],"empty":true,"format":"text"},"stdout":{"contains":["usage:"],"empty":false,"format":"text"}}},{"claim_classification":"compatibility","failure":{"argv":["metriplane","atlas","bundle","export","--mp2-015-invalid-option"],"exit_code":2,"filesystem":{"created":[],"modified":[],"removed":[]},"state":"unchanged","stderr":{"contains":["usage:","error:"],"empty":false,"format":"text"},"stdout":{"contains":[],"empty":true,"format":"text"}},"kind":"cli_command","profile_id":"repository.current-cli.measured","retained_obligation_id":"MP2-011.OBL.SUBPARSER_CENSUS","row_digest":"8aff96701f04077fed8ede2583c226fbb4542dbcbd11a4479159051acf4ad8b5","row_id":"MP2-011.CLI.COMMAND.METRIPLANE_ATLAS_BUNDLE_EXPORT","success":{"argv":["metriplane","atlas","bundle","export","--help"],"exit_code":0,"filesystem":{"created":[],"modified":[],"removed":[]},"state":"unchanged","stderr":{"contains":[],"empty":true,"format":"text"},"stdout":{"contains":["usage:"],"empty":false,"format":"text"}}},{"claim_classification":"compatibility","failure":{"argv":["metriplane","atlas","bundle